regNumber,labels,class_predict,name,connectedness
28537990,66,2.0,"Титульный лист к альбому «Подлинное представление строений и саду, находящихся в одном из увеселительных домов, называемом село Кусково...»",1.0
28563605,66,2.0,"Заглавный лист к альбому гравюр ""Подлинное представление строениев и саду, находящееся в одном из увеселительных домов, называемом село Кускова, принадлежащее его Cиятельству Господину графу Петру Борисовичу Шереметеву""",2.0
28563584,66,2.0,"Заглавный лист к альбому гравюр ""Подлинное представление строениев и саду, находящееся в одном из увеселительных домов, называемом село Кускова, принадлежащее его Cиятельству Господину графу Петру Борисовичу Шереметеву""",3.0
34677024,66,2.0,"Титульный лист из альбома ""Подлинное представление строениев и саду в одном из увеселительных домов называемом Кусково, принадлежащее его Cиятельству Господину графу Петру Борисовичу Шереметеву..."":",2.0
14170675,66,2.0,"офорт. Титульный лист ""Альбома села Кускова""",1.0
17333432,67,2.0,"Большой (Екатерининский) дворец. Дворцово-парковый ансамбль. 1717-24 гг., 1742 г., 1751-56 гг.; Дворцово-парковый ансамбль. Ленинградская обл., Царское Село.  Большой (Екатерининский) дворец. Из серии гравюр с видами загородных дворцов С.-Петербурга. Растрелли Франческо Бартоломео (Варфоломей Варфоломеевич); Браунштейн Иоганн Фридрих; Земцов Михаил Григорьевич; Квасов Андрей Васильевич. Фасад павильона Эрмитаж. Гравированы при Императорской Академии наук.",2.0
26623870,67,1.0,Вид здания Эрмитажа в Царскосельском парке.,2.0
28537399,67,2.0,"г. Санкт-Петербург. Эрмитаж. Екатерининский парк. 1744-46, 1748-54 гг. «Эрмитаж в Саду Ея Императорского Величества дворца в Царском Селе». Вид со стороны подъемного моста. Архитектор: Земцов М.Г.; Архитектор: Квасов А.В.; Архитектор-строитель: Чевакинский С.И.; автор проекта перестройки: Растрелли Ф.Б., В.В. Гравировано при Императорской Академии Наук и Художеств, Санкт-Петербург.",1.0
33620201,67,1.0,"г. Санкт-Петербург, г. Пушкин (Царское Село). Эрмитаж. Екатерининский парк. 1744-46 гг., 1748-54 гг. «Эрмитаж в Саду Ея Императорского Величества дворца в Царском Селе». Общий вид. Архитектор: Земцов М.Г.; Архитектор: Квасов А.В.; Архитектор-строитель: Чевакинский С.И.; автор проекта перестройки: Растрелли Ф.Б., В.В. Гравировальная мастерская при Императорской Академии наук и художеств, Санкт-Петербург.",1.0
39467586,67,2.0,Проспект здания Эрмитажа в Царскосельском парке,2.0
39467581,67,2.0,Проспект Эрмитажа в Царскосельском парке,2.0
39468120,67,2.0,Вид Эрмитажа в Царском Селе,2.0
39468107,67,2.0,Проспект павильона Эрмитаж в Царском селе,1.0
39470840,67,2.0,"Вид амфитеатра - полукруглой галерии в саду гр. Бестужевой-Рюминой на Каменном острове, в центре арка с надписью на трех языках",2.0
39470830,67,2.0,Проспект здания Эрмитажа в Царскосельском парке.,2.0
39471141,67,2.0,"Вид Эрмитажа в Царском Селе - в центре 2х этажный павильон под куполом, богато украшенный резьбой и колоннами, окруженный балюстрадой и рвом",2.0
39473014,67,2.0,Вид Эрмитажа в Царском Селе,2.0
39473317,67,2.0,Изображение здания Эрмитажа в Царскосельском парке на фоне Екатерининского дворца,2.0
40088908,67,2.0,Павильон Эрмитаж в Царском Селе.,2.0
5632021,67,2.0,Эрмитаж в саду Ее Императорского Величества дворца в Царском селе,3.0
4684706,67,2.0,Эрмитаж в Царском Селе,2.0
6229980,67,2.0,Эрмитаж в Царском Селе. Гравюра,1.0
14170674,67,2.0,офорт. Каскад в Вешнякове,2.0
10336917,67,2.0,Эрмитаж в Царском селе. По рисунку М.И. Махаева,2.0
16214575,67,2.0,Павильон Эрмитаж в Царском Селе,2.0
16214841,67,2.0,Павильон Эрмитаж в Царском Селе,2.0
17642632,67,2.0,Эрмитаж в Царском селе (с рисунка М.Махаева),2.0
19263233,68,1.0,Вид здания Государственных Коллегий со стороны Невы.,2.0
23464937,68,1.0,"""Петербург. Проспект Государственных коллегий"". Гравюра",1.0
26861141,68,1.0,Проспект Государственных Коллегий с частью Гостиного двора с восточной стороны. Гравюра,2.0
28545112,68,1.0,"г. Санкт-Петербург. Здание Двенадцати коллегий. Университетская наб., 7. 1722-42 гг. «Проспект Государственных коллегий с частию Гостиного двора с восточную сторону». Архитектор: Трезини Д.А.; Архитектор: Трезини К.Д.; Архитектор: Земцов М.Г.",1.0
30881786,68,2.0,Петербург. Проспект здания государственных коллегий с частью Гостиного двора,2.0
31747448,68,2.0,"г. Санкт-Петербург. Здание Двенадцати коллегий. Университетская наб., 7. 1722-42 гг. «Проспект Государственных коллегий с частию Гостиного двора в восточную сторону». Из издания «Планы столичного города Санкт-Петербурга...» (1753 г.). Архитектор: Трезини Д.А.; Архитектор: Трезини К.Д.; Архитектор: Земцов М.Г.",1.0
33598420,68,2.0,Здание Двенадцати коллегий. Перспективный вид («Проспект Государственных Коллегий с частью Гостиного двора в восточную сторону»). Из альбома с планом и видами г. Санкт-Петербурга по рисункам М.И. Махаева.,2.0
35309013,68,2.0,"Здание Двенадцати коллегий. Университетская наб., 7. 1722-42 гг., г. Санкт-Петербург (Ленинград), Здание Двенадцати коллегий. Перспективный вид. Из издания «Планы столичного города Санкт-Петербурга...» (1753 г.). Архитектор: Трезини Д.А.; Архитектор: Трезини К.Д.; Архитектор: Земцов М.Г.",1.0
39470834,68,2.0,"Вид здания Двенадцати коллегий на Васильевском острове, перед ним канал с двумя мостами, кареты, всадники, группы пешеходов",3.0
39473404,68,2.0,"Изображение слева здания двенадцати коллегий, с каналом и двумя мостиками, справа части Гостинного двора",2.0
40088922,68,3.0,Вид здания Государственнх коллегий и Гостиного двора.,2.0
16214507,68,2.0,Здания Государственных коллегий со стороны Невы,2.0
16214858,68,3.0,Здания Государственных коллегий со стороны Невы,2.0
6779713,69,1.0,Фотография. Гравюра Михаила Махаева. Первое изображение г. Симбирска.,5.0
21567716,69,0.0,Вид города Саранска с приезду на восток,1.0
22290768,69,2.0,Вид города Саранска с восточной стороны,2.0
31747792,69,3.0,"Республика Мордовия, г. Саранск. «Вид города Саранска с приезду на восток». Из серии «Собрание Российских и Сибирских городов» (1769-1771).",2.0
34675883,69,2.0,Вид города Сызрани с приезда к северо-востоку. Лист из «Собрания российских и сибирский городов».,3.0
34675834,69,2.0,Вид города Саранска с приезду на восток. Лист из «Собрания российских и сибирский городов».,3.0
36071724,69,2.0,(Россия.) Вид города Саранска с приезду на восток.,2.0
36071713,69,2.0,(Россия.) Вид города Саранска с приезду на восток.,2.0
36071682,69,2.0,(Россия.) Вид города Сызрани с приезда к северо-востоку.,2.0
40716657,69,2.0,Альбом «Собрание Российских и Сибирских городов». Вид Саранска.,2.0
40716627,69,2.0,Альбом «Собрание Российских и Сибирских городов». Вид Симбирска.,2.0
40716576,69,3.0,Альбом «Собрание Российских и Сибирских городов». Вид Сызрани.,2.0
10447455,69,3.0,Саранск (ХVIII в.),2.0
15811004,69,3.0,«Вид города Мангазей».1770. Из серии «Собрание Российских и Сибирских городов».,2.0
16837493,69,5.0,Вид города Тобольска,3.0
39467621,70,2.0,Проспект Аничкова дворца и Невской перспективы от реки Фонтанки,3.0
39467563,70,1.0,Проспект Аничкова дворца и Невской перспективы от реки Фонтанки,3.0
39467528,70,2.0,Проспект Аничкова дворца и Невской перспективной дороги,3.0
39468066,70,2.0,Проспект Аничкового дворца и Невской перспективной дороги,2.0
39472677,70,2.0,"Вид Невского проспекта от Фонтанки: на переднем плане - мост и река, за нею слева - Аничков дворец, Гостиный двор, церковь Казанской божией матери, вдали - Адмиралтейство, справа - жилая застройка проспекта и прилегающей территории",2.0
39472669,70,2.0,"Вид Невского проспекта от Фонтанки: на переднем плане река с гребными судами и деревянным мостом, далее-перспектива проспекта, замыкающаяся Адмиралтейством",2.0
39471104,70,3.0,Проспект новопостроенных палат против Аничковых ворот,2.0
39473375,70,3.0,Вид Невского проспекта от Фонтанки в сторону Адмиралтейства,2.0
16214817,70,3.0,Невский проспект от Фонтанки в сторону Адмиралтейства,2.0
31873672,71,4.0,"Махаев М.И. Иллюстрация к книге Н.Д. Шаховской «Два механика». - Москва : Посредник, 1933",4.0
22290774,71,2.0,Вид города Казани во время разлива реки Казанки,3.0
24220462,71,4.0,Вид Новгорода.,2.0
24220418,71,2.0,Вид Бронницкой горы близ Новгорода.,2.0
31729457,71,2.0,"Республика Татарстан, г. Казань. «Вид Казани во время водополья реки Казанки, к северо-западу представленный». Из серии «Собрание Российских и Сибирских городов» (1769-1771).",2.0
31729486,71,2.0,"Республика Татарстан, г. Казань. «Вид Казани во время водополья реки Казанки, к северо-западу представленный». Из серии «Собрание Российских и Сибирских городов» (1769-1771).",2.0
36071598,71,2.0,(Россия.) Вид Казани во время водополья реки Казанки к северо-западу представленный.,2.0
36071584,71,2.0,(Россия.) Вид Казани во время водополья реки Казанки к северо-западу представленный.,2.0
36391749,71,2.0,Гравюра. Вид города  Селенгинска,1.0
36935470,71,2.0,"Татарстан, г. Казань, «Вид Казани во время водополья реки Казанки, к северо-западу представленный». из серии «Собрание Российских и Сибирских городов».",1.0
37444762,71,2.0,"Гравюра. Вид Казани, во время водополья реки Казанки, к Северо-Западу представленный. По рисунку М.И.Махаева, 1768 г. (переработка рисунка А.И. Свечина, 1765 г.)",2.0
3558754,71,2.0,"Рисунок. Вид Казани, во время водополья р. Казанки к северо-западу представленный",1.0
39384348,71,2.0,Гравюра. Вид Казани во время водополья реки Казанки.,2.0
40716603,71,4.0,Альбом «Собрание Российских и Сибирских городов». Вид Казани.,2.0
17123680,72,4.0,Иллюстрация. 5. Здание Академии наук в первой половине XVIII века. С гравюры М. И. Махаева. из комплекта иллюстраций [М.В. Ломоносов в истории XVIII века: альбом иллюстраций и документов: наглядное учебное пособие по литературе для средней школы],4.0
28869175,72,2.0,"Проспект Старого Зимнего дворца с каналом, соединяющего Мойку с Невою. С рисунка М.И.Махаева, гравировал Е. Виноградом. Проспект по реке Фонтанке от Грота и запасного дворца на полдень. С рисунка М.И.Махаева, гравировал Г. Качалов. Лист из альбома ""Историческая панорама Санкт-Петербурга и его окрестностей"". Часть I ""От основания Петербурга до екатерининской эпохи"".",4.0
28869163,72,3.0,"Проспект палат против Аничковых ворот. С рисунка М.И.Махаева, гравюра Я.Васильева. Проспект Невской перспективной дороги. Лист 10 из альбома ""Историческая панорама Санкт-Петербурга и его окрестностей"". Часть I ""От основания Петербурга до екатерининской эпохи"".",4.0
28869138,72,3.0,"Проспект Старого Зимнего дворца с каналом, соединяющим Мойку с Невою. Проспект по реке Фонтанке от Грота и Запасного дворца на полдень. С рисунка М.И.Махаева, гравировал Г. Качалов. Лист из альбома ""Историческая панорама С.-Петербурга"", Ч.I - ""От основания Петербурга до екатерининской эпохи"".",4.0
28869108,72,4.0,"Проспект палат против Аничковских ворот. С рисунка М.И.Махаева, гравюра Я.Васильева. Проспект Невской перспективной дороги. С рисунка М.И.Махаева, гравюра Г. Качалова. Лист из альбома ""Историческая панорама С.-Петербурга"". Ч. I - ""От основания Петербурга до екатерининской эпохи"".",4.0
32975817,72,4.0,"Старый  Зимний дворец. Проспект по реке Фонтанке. С рис. М.И.Махаева гравировал Е.Виноградов.
Лист из издания: Историческая панорама Петербурга и его окрестностей. Часть I. От основания Петербурга до Екатерининской эпохи.",2.0
3747120,72,4.0,"Гравюра. Два вида Петербурга. ""Проспект вверх по Неве реке от Адмиралтейства..."" и ""Невский проспект от берега Фонтанки"".",2.0
10037056,72,4.0,"Фото-тинто-гравюра. Проспект новопостроенных палат против Аничковских ворот. (С гравюры 1753 года Я. Васильева по рисунку М. Махаева). Проспект Невской перспективной дороги. (С гравюры 1753 года  Г. Качалова по рисунку М. И. Махаева). Из комплекта ""Историческая панорама Санкт-Петербурга и его окрестностей"". Часть первая ""От основания Петербурга до Екатерининской эпохи"".",3.0
10037009,72,4.0,"Фото-тинто-гравюра. Проспект Старого Зимнего дворца с каналом, соединяющим Мойку с Невой. (С гравюры 1753 года Е. Виноградова по рисунку М. И. Махаева). Проспект по реке Фонтанке от грота и Запасного дворца на полдень. (С гравюры 1753 года Г. Качалова по рисунку М. И. Махаева). Из комплекта ""Историческая панорама Санкт-Петербурга и его окрестностей"". Часть первая ""От основания Петербурга до Екатерининской эпохи"".",3.0
19469099,73,2.0,Открытка художественная. Неизвестный художник по рисунку М. И. Махаева 1749 г. (Вид вниз по Неве от наплавного моста. 1750-е гг.,4.0
31873700,73,2.0,"Махаев М.И. Иллюстрация к книге Н.Д. Шаховской «Два механика». - Москва : Посредник, 1933",4.0
31873693,73,4.0,"Махаев М.И. Иллюстрация к книге Н.Д. Шаховской «Два механика». - Москва : Посредник, 1933",4.0
31873680,73,4.0,"Махаев М.И. Иллюстрация к книге Н.Д. Шаховской «Два механика». - Москва : Посредник, 1933",4.0
24709207,73,4.0,"Большой (Екатерининский) дворец. Дворцово-парковый ансамбль. 1717-24 гг., 1742 г., 1751-56 гг., 1817 г. г. Санкт-Петербург (Ленинград), г. Пушкин (Царское Село). Большой (Екатерининский) дворец. 1749-1756 гг. Растрелли Бартоломео Карло (Варфоломей) - отец. Вид дворца со стороны двора. Гравюра М.Махаева.",5.0
24709201,73,4.0,"Большой (Екатерининский) дворец. Дворцово-парковый ансамбль. 1717-24 гг., 1742 г., 1751-56 гг., 1817 г. г. Санкт-Петербург (Ленинград), г. Пушкин (Царское Село). Большой (Екатерининский) дворец. 1749-1756 гг. Растрелли Бартоломео Карло (Варфоломей) - отец. Вид дворца со стороны парка. Гравюра М.Махаева.",5.0
39468046,73,5.0,Вид нового Императорского Зимнего дворца и Эрмитажа на берегу Невы,2.0
16214800,73,5.0,Адмиралтейство со стороны Адмиралтейского луга,2.0
18358886,74,2.0,"Усадьба Кусково, ул. Юности, 2. XVIII в. г. Москва. Усадьба Кусково. Панорама усадьбы Кусково",4.0
18358898,74,1.0,"Усадьба Кусково, ул. Юности, 2. XVIII в. г. Москва. Усадьба Кусково. Из комплекта ""Подлинное представление строений и саду...Кусково"". Кологривов Ю. И.; Ухтомский Дмитрий Васильевич.; Бланк Карл Иванович; Аргунов Федор Семенович; Миронов Алексей Федорович; Дикушин Григорий Ефимович. Итальянский домик. Перспективный вид главного фасада на северо-восток.",2.0
18061355,74,2.0,Вид Московского Летнего дворца на Южной и Западной стороне. Гравюра,2.0
28538028,74,1.0,"г. Москва. Итальянский домик. Усадьба Кусково, ул. Юности, 2. 1754-1755 гг. Перспективный вид главного фасада на северо-восток. Лист из альбома «Подлинное представление строений и саду, находящихся в одном из увеселительных домов, называемом село Кусково...». Архитектор: Аргунов Ф.С.; Архитектор: Кологривов Ю.И.",2.0
28538035,74,1.0,"г. Москва. Менажерия. Усадьба Кусково, ул. Юности, 2. 1770-е гг. Общий вид на запад. Лист из альбома «Подлинное представление строений и саду, находящихся в одном из увеселительных домов, называемом село Кусково...». Архитектор: Аргунов Ф.С.",1.0
28538003,74,2.0,"г. Москва. Оранжерея. Усадьба Кусково, ул. Юности, 2. 1761-1762 гг. Вид с южной стороны. Лист из альбома «Подлинное представление строений и саду, находящихся в одном из увеселительных домов, называемом село Кусково...». Архитектор: Аргунов Ф.С.",2.0
28563596,74,3.0,"Проспект Итальянского Домика в Кускове, принадлежащем Его Сиятельству Графу Петру Борисовичу Шереметеву. Представлен на Северо-восток",2.0
28563595,74,2.0,"Проспект Оранжереи в саду села Кускова, принадлежащем Его Сиятельству Графу Петру Борисовичу Шереметеву. Представлен на Полдень",2.0
28563593,74,2.0,"Проспект Итальянского Домика в Кускове, принадлежащем Его Сиятельству Графу Петру Борисовичу Шереметеву. Представлен на Северо-восток",2.0
