regNumber,labels,class_predict,name,connectedness
16214797,32,2.0,Панорама Невы вниз по течению от Зимнего дворца и Академии наук; правая часть - Академия наук и Кунсткамера,2.0
16214781,32,3.0,Панорама Невы вверх по течению от Адмиралтейства и Академии наук; правая часть - Дворцовая набережная,2.0
2852123,32,2.0,Проспект вниз по Неве-реке между Зимним Ее Императорского Величества домом и Академией наук (Правая часть. По рисунку М.И. Махаева),2.0
2852179,32,5.0,Проспект вниз по Неве-реке между Зимним Ее Императорского Величества домом и Академией наук (Левая часть. По рисунку М.И. Махаева),2.0
29860160,33,1.0,План Москвы и окрестностей,1.0
34251358,33,2.0,Карта Африки.,2.0
34251376,33,1.0,План Царствующего Града Москвы с показанием лежащих мест на тридцати верст в округе. Вид Кремля...,2.0
34251368,33,1.0,Карта Европы.,2.0
34251313,33,1.0,«Изображение Земного глобуса».,2.0
34251307,33,2.0,Карта Северной и Южной Америки.,2.0
34251273,33,2.0,Карта Азии.,2.0
34258886,33,2.0,«Генеральная карта собранных Королевских Прусских земель» с планом баталии при деревне Гросс-Егерсдорфе 19 августа 1757 года. Атака крепости Мемеля 19/25 июня 1757 года.,2.0
34737676,33,2.0,"Гравюра. Генеральная карта Российской империи. Фрагмент. Из издания: Атлас Российский, состоящий из девятнадцати специальных карт [...]. Сост. И.Н. Делиль, Л. Эйлер. Грав. Г.И. Унферцахт, М.И. Махаев. СПб.: Тип. Императорской Академии Наук.",1.0
34737650,33,2.0,"Гравюра. Московская губерния с лежащими вкруг местами. Из издания: Атлас Российский, состоящий из девятнадцати специальных карт […]. Сост. И.Н. Делиль, Л. Эйлер. Грав. Г.И. Унферцахт, М.И. Махаев.  
СПб.: Тип. Императорской Академии Наук.",1.0
34737664,33,2.0,"Гравюра. Царство Казанское с окольными провинциями и частью реки Волги. Из издания: Атлас Российский, состоящий из девятнадцати специальных карт […]. Сост. И.Н. Делиль, Л. Эйлер. Грав. Г.И. Унферцахт, М.И. Махаев. СПб.: Тип. Императорской Академии Наук.",1.0
15683459,33,2.0,Гравюра. Географическое описание на Библию Священного Писания,1.0
10694666,34,0.0,"Кружка сувенирная ""Подьячий с приписью""",4.0
10694677,34,0.0,"Кружка сувенирная ""Городовой воевода""",4.0
20408349,34,0.0,"Галстук мужской классический с надписями ""Симбирск-Ульяновск"". Изготовлен по заказу Городской Думы к 355-летию города. Принадлежал Зубову А.Н.",4.0
20395753,35,2.0,"Гравюра ""Дворец в Царском Селе"" (Лист № 1)",1.0
20395752,35,1.0,"Гравюра ""Дворец в Царском Селе"" (Лист № 2)",1.0
28549048,35,1.0,"г. Пушкин (Царское Село). Большой (Екатерининский) дворец. Дворцово-парковый ансамбль. 1717-24 гг., 1742 г., 1751-56 гг., 1817 г. Перспектива со стороны парадного двора. автор проекта перестройки: Растрелли Ф.Б., В.В.; автор первоначального проекта: Браунштейн И.; Архитектор: Земцов М.Г.; Архитектор: Квасов А.В.; Архитектор: Чевакинский С.И. Гравировано при Императорской Академии наук и художеств, Санкт-Петербург",1.0
36967590,35,1.0,Вид дворца в Царском селе. Гравюра,2.0
39467619,35,1.0,Панорама Царскосельского дворца (левый лист),3.0
39468034,35,2.0,"Вид Большого дворца в Стрельне, со стороны нижнего парка, слева - дворец, справа партер сада",2.0
39468028,35,2.0,Вид дворца в Ораниенбауме со стороны Финского залива,2.0
2042371,35,2.0,Дворец Ея Императорского Величества въ Сарском Селъ в 25-ти верстахъ отъ Санкт-Петербурга. Гравюра на двух листах. Лист 1,1.0
10768988,35,2.0,Царское село. Дворец его императорского величества. Вид на Большой Царскосельский дворец.,2.0
10768947,35,2.0,Стрельна. Мыза на Финляндском заливе. Вид на дворец в Стрельне,2.0
10970095,35,2.0,Вид дворца в Царском Селе. Гравюра,2.0
16667826,35,2.0,Дворец в Царском селе. С рисунка М.И. Махаева. Гравюра,1.0
18053851,35,2.0,Красное крыльцо и Грановитая палата. Гравюра,2.0
39467618,36,2.0,"Изображение слева здания двенадцати коллегий, с каналом и двумя мостиками, справа части Гостинного двора",3.0
39467584,36,2.0,Проспект здания Двенадцати коллегий и части Гостиного двора,2.0
39468136,36,3.0,Проспект здания Двенадцати Коллегий и части Гостиного двора,2.0
39472622,36,2.0,"Вид на здание 12 коллегий на Васильевском острове: слева здание коллегий и канал с двумя деревянными мостиками, в центре - поле с фигурами горожан, телегами, колясками, справа - часть гостиного двора",2.0
39473004,36,2.0,Проспект здания Государственных Коллегий с частью Гостиного двора,2.0
16214836,36,2.0,Вид здания Двенадцати коллегий со стороны Невы,2.0
16214805,36,2.0,Вид здания Двенадцати коллегий со стороны Невы,2.0
40633911,37,1.0,"Общий вид усадьбы Кусково с северной стороны, г. Москва. Вид с гравюры М.И. Махаева",5.0
26708340,37,1.0,План Петербурга 1753 г.,1.0
26708353,37,1.0,План Петербурга 1753 г.,1.0
26708349,37,1.0,План Петербурга 1753 г.,1.0
28868908,37,1.0,План Петербурга 1753 г.,1.0
28868871,37,1.0,План Петербурга 1753 г.,1.0
28868847,37,1.0,План Петербурга 1753 г.,1.0
28868858,37,1.0,План Петербурга 1753 г.,1.0
29295503,37,4.0,"Текстильный рисунок для ткани. Из альбома ""Творческие работы учащихся""/ МЛП СССР Ивановский химико-технологический техникум. Художественно-колористическое отделение. ",2.0
5631064,37,3.0,План Санкт-Петербурга. Лист 9.,3.0
5630814,37,3.0,План Санкт-Петербурга. Лист 2.,3.0
14170673,37,5.0,офорт. Колонна в Кускове в честь Екатерины II,2.0
7411247,38,1.0,Доска медная гравированная,1.0
21509375,38,1.0,"Тезис, посвященный вступлению Екатерины II на престол (с видом Сергиевой пустыни). Гравюра",2.0
30699077,38,1.0,"Вид Соловецкого монастыря (№7). Лист из атласа ""Виды Соловецкого монастыря"".",2.0
37735308,38,1.0,"Вид Соловецкого монастыря с преподобными Германом, Зосимой, Савватием и святым Филиппом-митрополитом, гравюра",1.0
16290965,38,1.0,Тезис Соловецкого монастыря,1.0
2550835,38,1.0,Соловецкий монастырь с житием преп. Зосимы и Савватия Соловецких. Гравюра,1.0
2550747,38,2.0,Соловецкий монастырь с житием преп. Зосимы и Савватия Соловецких. Гравюра,1.0
16960940,38,2.0,гравировальная доска «Тезис в честь Екатерины II Лаврентия Хоцятовского с видом Троице-Сергиевой пустыни».,1.0
28868910,39,1.0,План Петербурга 1753 г.,1.0
28868894,39,1.0,План Петербурга 1753 г.,1.0
28868893,39,1.0,План Петербурга 1753 г.,1.0
28868846,39,1.0,План Петербурга 1753 г.,1.0
28868812,39,1.0,План Петербурга 1753 г.,1.0
28868831,39,1.0,План Петербурга 1753 г.,1.0
39467617,39,1.0,Лист нижней правой части плана С.-Петербурга с обозначением Васильевского острова и устья Невы,1.0
16215044,39,1.0,План Петербурга 1753 г.,1.0
26708314,39,1.0,План Петербурга 1753 г.,1.0
16215030,39,1.0,План Петербурга 1753 г.,1.0
16214993,39,1.0,План Петербурга 1753 г.,1.0
16215020,39,1.0,План Петербурга 1753 г.,1.0
16214990,39,1.0,План Петербурга 1753 г.,1.0
16214961,39,1.0,План Петербурга 1753 г.,1.0
16214951,39,2.0,План Петербурга 1753 г.,1.0
40633897,40,2.0,"План усадьбы Кусково, г. Москва. Вид с гравюры М.И. Махаева",5.0
28563604,40,2.0,"План увеселительного дома села Кускова, принадлежащего Его Сиятельству Графу Петру Борисовичу Шереметеву",3.0
28563597,40,2.0,"План увеселительного дома села Кускова, принадлежащего Его Сиятельству Графу Петру Борисовичу Шереметеву",2.0
28563594,40,2.0,"План увеселительного дома села Кускова, принадлежащего Его Сиятельству Графу Петру Борисовичу Шереметеву",3.0
34677057,40,5.0,"План увеселительного дома села Кускова. Лист из альбома ""Подлинное представление строениев и саду в одном из увеселительных домов называемом Кусково, принадлежащее его Cиятельству Господину графу Петру Борисовичу Шереметеву..."".",2.0
17333401,41,1.0,"Большой (Екатерининский) дворец. Дворцово-парковый ансамбль. 1717-24 гг., 1742 г., 1751-56 гг.; Дворцово-парковый ансамбль. Ленинградская обл., Царское Село.  Охотничий домик. Из серии гравюр с видами загородных дворцов С.-Петербурга. Растрелли Франческо Бартоломео (Варфоломей Варфоломеевич); Браунштейн Иоганн Фридрих; Земцов Михаил Григорьевич; Квасов Андрей Васильевич. Фасад. Гравированы при Императорской Академии наук.",2.0
25575007,41,2.0,г. Пушкин. Охотничий павильон. С гравюры Махаева.,5.0
25065504,41,1.0,Гравюра. «Царское село. Охотничий павильон».,1.0
26623781,41,2.0,Вид Охотничьего павильона Монбижу в Зверинце Царскосельского парка.,2.0
39467571,41,2.0,Проспект охотничьего павильона в Зверинце Царского села.,2.0
39471150,41,2.0,"Вид Охотничьего Павильона и зверинца в Царском селе - в центре павильон с куполом и парадной лестницей, ведущей на 2-ой этаж",2.0
39472984,41,2.0,Вид Монбежа в Царском селе,2.0
39473401,41,2.0,Изображение охотничьего павильона в Зверинце Царского села на фоне декоративной зелени,2.0
40088879,41,2.0,Охотничий павильон в Зверинце в Царском Селе.,2.0
6229974,41,2.0,Охотничий павильон в Зверинце. Гравюра,2.0
11627121,41,2.0,Гравюра. Охотничий павильон в Зверинце в Царском Селе.,1.0
12531123,41,2.0,"Фото-тинто-гравюра. Монбеж (Охотничий павильон) в Царском Селе, в Зверинце. (С гравюры по рисунку М. Махаева середины 18 века). из комплекта печатной графики ""Историческая панорама Санкт-Петербурга и его окрестностей. Часть седьмая. Царское Село.""",3.0
16214862,41,3.0,"Охотничий павильон ""Монбижу"" в Зверинце Царского Села",2.0
16215989,41,0.0,"Охотничий павильон ""Монбижу"" в Зверинце Царского Села",1.0
22290654,42,2.0,Вид на город Чебоксары с реки Волги,3.0
29040912,42,1.0,"Гравюра. Вид Казани. По рисунку Л.–Н. Де Леспинаса. Переработка рисунка М.И. Махаева 1766 года.
Из  альбома-приложения к книге Н. Леклерка «Le Clerc. Histoire physique, morale, civile,et politique de la Russie ancienne et moderne». Paris. 1783-1784. (Физическая, моральная, гражданская и политическая история древней и современной России. Париж. 1783 – 1784).",3.0
31752573,42,1.0,"Чувашская республика, г. Чебоксары. «Вид города Чебоксары на р. Волгу к северу». Из серии «Собрание Российских и Сибирских городов» (1769-1771).",1.0
34675885,42,1.0,Вид города Чебоксара на р. Волгу к северу. Лист из «Собрания российских и сибирский городов».,3.0
34675846,42,2.0,Вид города Чебоксара на р. Волгу к северу. Лист из «Собрания российских и сибирский городов».,3.0
36071727,42,2.0,(Россия.) Вид города Чебоксары на р. Волгу к северу.,2.0
36071717,42,2.0,(Россия.) Вид города Чебоксары на р. Волгу к северу.,2.0
38571218,42,3.0,Вид города Чебоксары.,3.0
40716580,42,3.0,Альбом «Собрание Российских и Сибирских городов». Вид Чебоксар.,2.0
11633246,42,3.0,Чебоксары.,2.0
11633215,42,3.0,Чебоксары.,2.0
11633237,42,1.0,Чебоксары.,2.0
29905225,43,2.0,Старый С.-Петербург. Вид Аничкина дворца и Невского проспекта в начале царствования Екатерины II.,3.0
29905186,43,2.0,Старый С.-Петербург. Невский проспект и Адмиралтейство.,3.0
17333378,44,2.0,"Большой Меншиковский дворец. 3-й переулок. 1710-1727. Лениниградская  обл., г. Ораниенбаум (Ломоносов). Большой Меншиковский дворец. Из серии гравюр с видами загородных дворцов С.-Петербурга. Фонтана Джованни Марио; Шедель Иоганн Готфрид. Фасад. Перспектива. Гравированы при Императорской Академии Наук и Художеств.",2.0
39862904,44,2.0,Ораниенбаум. Большой дворец. Репродукция гравюры Ф. П. Внукова и Н. Ф. Челнакова по рисунку М. И. Махаева (1757).,4.0
23044479,44,2.0,Панорама Большого Ораниенбаумского дворца. (Правая половина панорамы). часть двухлистовой гравюы «Проспект Ораниенбаума»,2.0
28539994,44,2.0,"г. Санкт-Петербург (Ленинград), г. Ломоносов (Ораниенбаум). Большой (Меншиковскй) дворец. Ораниенбаум дворцово-парковый ансамбль. 1711-1727 гг. Перспективный вид дворца и парка, в сторону Финского залива и Кронштадта. А. Табл. 10. Из издания Н.Г. Леклерка «История естественная, нравственная, гражданская...России» (N.G. Le Clerc, Atlas Volume of “Histoire physique, morale...de la Russie ...”). Архитектор: Фонтана Д.М.; Архитектор: Шедель И.Г.; Архитектор: Браунштейн И.; Архитектор: Шлютер А.",3.0
28682408,44,2.0,Вид Большого Ораниенбаумского дворца со стороны залива.,2.0
34251355,44,2.0,Большой дворец в Ораниенбауме.  Увраж «План столичного города Санктпетебурга с изображением знатнейших проспектов...изданный трудами Императорской академии наук и художеств в Санктпетербурге 1753 года».,2.0
38720675,44,2.0,"Большой (Меншиковский) дворец. Ораниенбаум дворцово-парковый ансамбль. 1711-1727 гг., г. Санкт-Петербург (Ленинград), г. Ломоносов (Ораниенбаум), Вид дворца со стороны залива. Архитектор: Фонтана Д.М.; Архитектор: Шедель И.Г.; Архитектор: Браунштейн И.; Архитектор: Шлютер А.",2.0
39472662,44,2.0,"Вид на Ораниенбаумский дворец со стороны Финского залива: на переднем плане, слева - пирс с парусным кораблем и пристань с фигурами людей",2.0
39472613,44,2.0,"Вид на Ораниенбаумский дворец со стороны Финского залива: на переднем плане, слева - пирс с парусным кораблем и пристань с фигурами людей",2.0
40089269,44,1.0,Вид Большого Ораниенбаумского дворца.,2.0
7059943,44,2.0,"Проспект Ораниенбаума, увеселительного дворца Ее Императорского Величества при Финляндском заливе против Кронштадта. Лист из альбома ""Виды окрестностей Санкт-Петербурга""",2.0
7059850,44,2.0,"Проспект Ораниенбаума, увеселительного дворца Ее Императорского Величества при Финляндском заливе против Кронштадта. Лист из альбома ""Виды окрестностей Санкт-Петербурга""",2.0
10768964,44,2.0,Ораниенбаум на Финляндском заливе. Вид на Ораниенбаумский дворец,2.0
10972633,44,2.0,"Проспект Ораниенбаума. 
С рисунка М.И. Махаева
Гравюра",2.0
11902839,44,2.0,"Гравюра на меди. Проспект Ораниенбаума (гравюра на 2 листах)
",2.0
15733519,44,2.0,"«Проспект Ораниенбаума, увеселительного дворца Его Императорского Высочества Благоверного Государя Наследника и Великого Князя Петра Федоровича при Финляндском заливе против Кронштадта».1761. По рисунку Махаева М.И.",2.0
16033779,44,1.0,"Вид Большого дворца в Ораниенбауме (на 2-х, склеенных вместе, листах)",2.0
16214786,44,0.0,"Вид Ораниенбаумского дворца; (""Проспект Ораниенбаума, увеселительного дворца Ея Императорскаго Величества при Финляндском заливе против Кронштадта"")",2.0
39133046,45,1.0,"Вид реки Фонтанки от Грота и Запасного дворца. 1753 г. Гравер Г. А. Качалов с рисунка М. И. Махаева. Офорт, гравюра.",4.0
33808680,45,2.0,Гравюра. Проспект по реке Фонтанке от Грота и Запасного дворца на полдень.,2.0
28456804,45,2.0,Вид реки Фонтанки у Летнего сада. Гравюра,2.0
28545118,45,1.0,г. Санкт-Петербург. Грот. Летний сад. 1704-1720 гг. 1714-19 гг. «Проспект по реке Фонтанке от Грота и Запасного дворца на полдень». Строитель: Маттарнови И.С.; Строитель: Микетти Н.; Строитель: Земцов М.Г.; Архитектор: Шлютер А.,2.0
36967605,45,2.0,Проспект по реке Фонтанке от Грота и Запасного дворца на полдень. С рисунка М. И. Махаева. Гравюра,2.0
39472623,45,2.0,Проспект по реке Фонтанке от Грота,2.0
4066788,45,2.0,"Проспект по реке Фонтанке. С рисунка Махаева. Из альбома ""План столичного города Санктпетербурга с изображением знатнейших оного проспектов, изданный трудами Императорской Академии Наук и Художеств в Санктпетербурге 1753 года""",2.0
40088905,45,2.0,Перспективный вид Фонтанки от Запасного дворца и грота вниз по течению.,2.0
6015595,45,2.0,Вид на канал с парусниками.,1.0
6181078,45,2.0,Вид устья реки Фонтанки от Грота и Западного дворца.1753 г. Графический лист,2.0
6558115,45,4.0,Санкт-Петербург. Проспект по реке Фонтанке от грота и запасного дворца на полдень. Коллекция И.С. Зильберштейна,4.0
16214840,45,2.0,Река Фонтанка у Летнего сада,2.0
17152569,46,2.0,"(Россия, Москва). ""Виды половины XVIII столътiя"". [Вид Кремля с Каменного моста. Вид Успенского собора и Грановитой палаты]. Таблица [14].",3.0
17152552,46,2.0,"(Россия, Москва). ""Виды половины XVIII столътiя"". [Вид Московского Летнего дворца. Вид Кремля из Замоскворечья]. Таблица [17].",3.0
6283610,46,3.0,"Отпечаток фотомеханический. Виды половины XVIII столетия: 
1. Вид Кремля в Москве с Каменного моста через Москву-реку;
2. Вид Успенского собора и Грановитой палаты с частью Ивана Великого.",5.0
6283606,46,3.0,"Отпечаток фотомеханический. Виды половины XVIII столетия:
1. Вид Московского Летнего дворца с Южной и Западной стороны;
2. Вид Кремля из-за Москворечье",5.0
