regNumber,labels,class_predict,name,connectedness
34257018,16,1.0,Кремль. Вид старого дворца с Красным крыльцом и Золотой решеткой (Боярская площадка). 1 серия. Лист 3-й. Придворный календарь на 1765 г. Гр. Н.Челнаков.,2.0
34256949,16,1.0,Кремль. Вид Успенского собора и Грановитой палаты. 1-я серия. Лист 2-й. Придворный календарь на 1765 г.,2.0
34256944,16,2.0,Кремль. Красное крыльцо и Грановитая палата. 1-я серия. Лист 4-й. Придворный календарь на 1765 г. Гр. И.Стрижев.,2.0
34256946,16,2.0,Кремль. Вид Успенского собора и Грановитой палаты. 1-я серия. Лист 2-й. Придворный календарь на 1765 г.,2.0
36071628,16,2.0,(Россия. Москва.) Вид Триумфальных ворот на Тверской улице в Белом городе. Лист № 3,1.0
36071613,16,2.0,(Россия. Москва.) Вид Триумфальных ворот из Земляного города к Тверской Ямской. Лист № 2,2.0
36071609,16,2.0,(Россия. Москва.) Вид Триумфальных ворот в Земляном городе. Лист № 7,1.0
36071569,16,2.0,(Россия. Москва.) Вид Успенского собора и Грановитой палаты с частью Ивана Великого.  Лист № 2,2.0
39468043,16,2.0,"""Вид Триумфальных ворот на Тверской улице в Белом городе""",2.0
39473393,16,2.0,"""Вид Триумфальных ворот из Землянова города к тверской"", на переднем плане многочисленные конные и пешие фигурки",2.0
39473349,16,2.0,"""Вид Никольских триумфальных ворот"" в Москве, слева здание цейхгауза, на переднем плане многочисленные человеческие фигурки, внизу слева ""С.М. Махаев"" и надписи на русском и франц. языках",2.0
39473327,16,2.0,"""Вид Воскресенских триумфальных ворот от каретнова мосту"" с многочисленными фигурками на переднем плане",2.0
4084940,16,2.0,Вид Кремля из-за Москворечья,1.0
4084935,16,1.0,Вид Воскресенских Триумфальных ворот со стороны Куретного моста,1.0
4084930,16,2.0,Вид Триумфальных ворот из Земляного города к Тверской-Ямской,1.0
4084920,16,2.0,Вид Триумфальных ворот на Тверской улице в Белом городе,1.0
18061112,16,2.0,Вид Успенского собора и Грановитой палаты с частью Ивана Великого. Гравюра,2.0
18061401,16,2.0,Вид Триумфальных ворот на Тверской улице в Белом городе. Гравюра,2.0
18061410,16,2.0,Вид Нового дворца в Кремле с южной стороны. Гравюра,2.0
18358906,17,1.0,"Усадьба Кусково, ул. Юности, 2. XVIII в. г. Москва. Усадьба Кусково. Из комплекта ""Подлинное представление строений и саду...Кусково"". Кологривов Ю. И.; Ухтомский Дмитрий Васильевич.; Бланк Карл Иванович; Аргунов Федор Семенович; Миронов Алексей Федорович; Дикушин Григорий Ефимович. Перспективный вид беседки в зверинце.",2.0
18358901,17,1.0,"Усадьба Кусково, ул. Юности, 2. XVIII в. г. Москва. Усадьба Кусково. Из комплекта ""Подлинное представление строений и саду...Кусково"". Кологривов Ю. И.; Ухтомский Дмитрий Васильевич.; Бланк Карл Иванович; Аргунов Федор Семенович; Миронов Алексей Федорович; Дикушин Григорий Ефимович. Голландский домик. Перспективный вид на фасад со стороны Большого Дворцового пруда.",2.0
28538005,17,2.0,"г. Москва. Усадьба Кусково, ул. Юности, 2. XVIII в. Беседка на канале в конце сада. Общий вид с лабиринтом. Лист из альбома «Подлинное представление строений и саду, находящихся в одном из увеселительных домов, называемом село Кусково...». Архитектор: Кологривов Ю.И.; Архитектор: Ухтомский Д.В.; Архитектор: Бланк К.И.; Архитектор: Аргунов Ф.С.; Архитектор: Миронов А.Ф.; Архитектор: Дикушин Г.Е.",1.0
28537983,17,2.0,"г. Москва. Усадьба Кусково, ул. Юности, 2. XVIII в. Вид парка с беседкой. «Проект особливой Беседки в Зверинце, находящемся между Кускова и Вешнякова...на полдень». Лист из альбома «Подлинное представление строений и саду, находящихся в одном из увеселительных домов, называемом село Кусково...». Архитектор: Кологривов Ю.И.; Архитектор: Ухтомский Д.В.; Архитектор: Бланк К.И.; Архитектор: Аргунов Ф.С.; Архитектор: Миронов А.Ф.; Архитектор: Дикушин Г.Е.",1.0
28563607,17,2.0,"Проспект Беседки в Зверинце, находящейся между Кусково и Вешняково, принадлежащих Его Сиятельству Графу Петру Борисовичу Шереметеву. Представлен на Полдень",3.0
28563603,17,2.0,"Проспект Эрмитажа в саду села Кускова, принадлежащего Его Сиятельству Графу Петру Борисовичу Шереметеву. Поставлен в средине восьми Куртин",2.0
28563598,17,2.0,Проспект Голландского Домика в селе Кускове принадлежащем Его Сиятельству Графу Петру Борисовичу Шереметеву. Представлен на Полдень,3.0
28563587,17,2.0,"Проспект Эрмитажа в саду села Кускова, принадлежащего Его Сиятельству Графу Петру Борисовичу Шереметеву. Поставлен в средине восьми Куртин",2.0
31600781,17,2.0,"Вид беседки в Зверинце в усадьбе Кусково. Лист из альбома ""Подлинное представление строений и саду, находящихся в одном из увеселительных домов, называемом село Кусково..."".",2.0
34057721,17,2.0,"Зверинец в Кусково. Лист из альбома ""Подлинное представление строениев и Саду, находящихся в одном из увеселительных домов, называемым Село Кусково, принадлежащее Его Сиятельству господину Графу Петру Борисовичу Шереметеву...""",2.0
34057702,17,2.0,"Кусково. Круглая беседка. Лист из альбома ""Подлинное представление строениев и Саду, находящихся в одном из увеселительных домов, называемым Село Кусково, принадлежащее Его Сиятельству господину Графу Петру Борисовичу Шереметеву...""",2.0
34677088,17,2.0,"Проспект Круглой Беседки на канале в конце Кусковского сада. Лист из альбома ""Подлинное представление строениев и саду в одном из увеселительных домов называемом Кусково, принадлежащее его Cиятельству Господину графу Петру Борисовичу Шереметеву..."".",2.0
34677059,17,2.0,"Проспект Голландского Домика в селе Кускове. Лист из альбома ""Подлинное представление строениев и саду в одном из увеселительных домов называемом Кусково, принадлежащее его Cиятельству Господину графу Петру Борисовичу Шереметеву..."".",2.0
34677051,17,2.0,"Проспект Беседки в Зверинце, находящейся между Кусково и Вешняково. Лист из альбома ""Подлинное представление строениев и саду в одном из увеселительных домов называемом Кусково, принадлежащее его Cиятельству Господину графу Петру Борисовичу Шереметеву..."".",2.0
39468087,17,2.0,Вид беседки в Зверинце в селе Кусково.,1.0
39470800,17,2.0,"Вид здания Эрмитажа в саду гр. Бестужевой-Рюминой на Каменном острове, на переднем плане пристань, по сторонам павильоны и шпалеры деревьев, смыкающихся за Эрмитажем",2.0
9164143,17,2.0,"Проспект особливой Беседки в Зверинце.
Лист из альбома «Подлинное представление строениев и саду, находящееся в одном из увеселительных домов, называемом село Кускова, принадлежащее его Ciятельству Господину графу Петру Борисовичу Шереметеву»

Гравюра",1.0
14170672,17,2.0,офорт. Круглая беседка в Кускове,2.0
16214792,17,2.0,Павильон Эрмитаж в саду Бестужевых-Рюминых на Каменном острове,2.0
19262903,18,1.0,"Петербург, 1750-е гг.",2.0
19263264,18,1.0,План Санкт-Петербурга 1753 года.,1.0
19263202,18,1.0,План Санкт-Петербурга 1753 года.,1.0
28539991,18,1.0,"г. Санкт-Петербург. План 1753 г. с экспликацией, гравированный при Академии наук и художеств. Табл. 1. Из издания Н.Г. Леклерка «История естественная, нравственная, гражданская...России» (N.G. Le Clerc, Atlas Volume of “Histoire physique, morale...de la Russie ...”).",3.0
31736651,18,1.0,План 13 частей г. Петербурга с аксонометрическим изображением ряда зданий. Лист VII с изображением Васильевской части.,1.0
31736582,18,1.0,План 13 частей г. Петербурга с аксонометрическим изображением ряда зданий. Лист VI с изображением С.-Петербургской и Васильевской частей.,1.0
31736609,18,1.0,План 13 частей г. Петербурга с аксонометрическим изображением ряда зданий. Лист IX с изображением Московской и Адмиралтейской частей.,1.0
31736620,18,1.0,"План 13 частей г. Петербурга с аксонометрическим изображением ряда зданий. Лист V с изображением Адмиралтейской, Литейной, Васильевской и С.-Петербургской частей.",1.0
31736587,18,1.0,План 13 частей г. Петербурга с аксонометрическим изображением ряда зданий. Лист VIII с изображением Адмиралтейской и Васильевской частей.,1.0
33611084,18,1.0,План 13 частей города с аксонометрическим изображением отдельных зданий. Из альбома с планом и видами г. Санкт-Петербурга по рисункам М.И. Махаева.,2.0
36935445,18,2.0,"г. Санкт-Петербург (Ленинград), План 13 частей г. Петербурга с аксонометрическим изображением ряда зданий. Лист II с изображением фрагмента Выборгской части и Литейной части.",1.0
36935430,18,2.0,"г. Санкт-Петербург (Ленинград), План 13 частей г. Петербурга с аксонометрическим изображением ряда зданий. Лист V с изображением Адмиралтейской, Литейной, Васильевской и С.-Петербургской частей.",1.0
36935424,18,1.0,"г. Санкт-Петербург (Ленинград), План 13 частей г. Петербурга с аксонометрическим изображением ряда зданий. Лист VI с изображением С.-Петербургской и Васильевской частей.",1.0
8662460,18,3.0,"«План столичного города Санкт-Петербурга с изображением знатнейших оного проспектов». 

Столичный город С Петербург Елисавете I Всероссийской императрице Петра Великаго дщери посвящено. 

",2.0
33620232,19,1.0,"г. Санкт-Петербург, г. Пушкин (Царское Село). Большой (Екатерининский) дворец. Дворцово-парковый ансамбль. 1717-24 гг., 1742 г., 1751-56 гг., 1817 г. «Дворец Ея И.В. в Царском Селе в 25 верстах от Санктпетербурга». Правая часть. автор проекта перестройки: Растрелли Ф.Б., В.В.; автор первоначального проекта: Браунштейн И.; Архитектор: Земцов М.Г.; Архитектор: Квасов А.В.; Архитектор: Чевакинский С.И. Гравировальная мастерская при Императорской Академии наук и художеств, Санкт-Петербург.",1.0
39467545,19,1.0,Панорама Царскосельского дворца (правый лист),2.0
39470839,19,2.0,"Вид дачи гр. Бестужевой-Рюминой, на Каменном острове с берега Малой Невки, на первом плане плот с палаткой и тремя плотовщиками, внизу франц. надпись",2.0
39470728,19,2.0,"Вид на дачу гр. Бестужевой-Рюминой на Каменном острове, здание с колонадой, в центре, перед ней пристань",2.0
39470745,19,2.0,"Вид на дачу гр. Бестужевой-Рюминой, как инв. № 20182, но внизу надпись по русски и французски",2.0
39470747,19,2.0,"Вид дачи гр. Бестужевой-Рюминой, на Каменном острове с берега Малой Невки, на первом плане плот с палаткой и тремя плотовщиками, внизу франц. надпись",2.0
39471101,19,2.0,Правая часть вида Екатерининского дворца и парадного двора в Царском Селе,2.0
39473005,19,2.0,"Вид дворца гр. Бестужевой-Рюминой на Каменном острове: на первом плане слева - парусник и лодка, справа - лодка на реке Невке",2.0
39473405,19,2.0,Правая половина изображения Екатерининского дворца в Царском селе со стороны парадного двора,2.0
40088966,19,2.0,Вид Большого Царскосельского дворца со стороны главного въезда.,2.0
3725695,19,2.0,Гравюра. Дворец Е.И.В. в Царском Селе в 25 верстах от С.-Петербурга.,1.0
16214849,19,2.0,Большой Царскоселький дворец со стороны парадного двора. Правая половина,2.0
16214793,19,2.0,Дворец Бестужевых-Рюминых на Каменном острове со стороны реки,2.0
19263289,20,1.0,Вид Адмиралтейства и части Невского проспекта.,2.0
35309000,20,2.0,"Главное Адмиралтейство. 1806-1823 гг.,  г. Санкт-Петербург (Ленинград), «Проспект Адмиралтейства и около лежащих строений с частию Невской перспективной дороги с западную сторону». Из издания «Планы столичного города Санкт-Петербурга...» (1753 г.). Архитектор: Захаров А.Д.",1.0
39473379,20,2.0,"Вид Адмиралтейства с частью невской перспективной дороги, обсаженной по сторонам деревьями в два ряда, с решетками и уличными фонарями",2.0
16214392,20,2.0,"Проспект Адмиралтейства и около лежащих строений с частию Невской перспективной дороги с западную сторону 
Из альбома ""План столичного города Санктпетербурга с изображением знатнейших онаго проспектов, изданных трудами Императорской Академии наук и художеств в Санктпетербурге"". СПб., 1753.",2.0
16214535,20,2.0,Адмиралтейство со стороны Адмиралтейского луга,2.0
16214826,20,2.0,Адмиралтейство со стороны Адмиралтейского луга,2.0
16214767,20,2.0,Адмиралтейство со стороны Адмиралтейского луга,2.0
24999576,21,1.0,Портрет первого российского солдата Сергея Бухвостова,1.0
24999605,21,1.0,Портрет С. Бухвостова в старости,1.0
24999562,21,1.0,Портрет первого российского солдата Сергея Бухвостова,1.0
30388723,21,1.0,Гравюра. Портрет Сергея Леонтьевича Бухвостова.,2.0
30869435,21,1.0,Портрет Сергея Леонтьевича Бухвостова (1642 или 1659-1728) в старости. Репродукция,4.0
31324930,21,2.0,Портрет Леонтия Бухвостова,2.0
32800564,21,1.0,"гравюра. Сергей Леонтьевич Бухвостов (1642 - 1728), первый российский солдат.",1.0
33930021,21,2.0,Сергей Леонтьевич Бухвостов,2.0
36176164,21,3.0,Сергей Леонтьевич Бухвостов,2.0
37736436,21,1.0,"Портрет С.Л. Бухвостова (Первый российский солдат Сергей Леонтьевич Бухвостов), гравюра",1.0
40670421,21,1.0,Портрет Бухвостова Сергея Леонтьевича,1.0
17130962,21,2.0,Портрет Сергея Леонтьевича Бухвостова,1.0
26623908,22,3.0,Здание Двенадцати коллегий на Васильевском острове.,2.0
26623930,22,2.0,Вид Невской перспективы у Аничкова дворца.,2.0
40088936,22,2.0,Старый Зимний дворец.,3.0
17198304,22,2.0,"Негатив на стеклянном носителе. Проспект вниз по Неве реке, гравюра М.И. Махаева.",5.0
21595736,22,2.0,"Репродукция с гравюры Махаева М.И. Панорама Невы с видом на палаты графа Апраксина, на Адмиралтейство и Васильевский остров. 1730 - 1740-х годов.",4.0
22142534,22,2.0,Проспект вниз по Неве реке между Зимним дворцом и Академией наук.,2.0
26623794,22,2.0,Панорама Невы вниз по течению от Исаакиевской церкви и Кадетского корпуса.,2.0
26623921,22,2.0,Вид здания Государственных коллегий со стороны Невы.,2.0
26623750,22,2.0,Панорама Невы от Адмиралтейства и Академии Наук вверх по течению.,2.0
26624027,22,2.0,Панорама Невы вверх по течению от Галерной верфи и 13-й линии Васильевского острова.,2.0
26707582,22,2.0,Вид дачи графини Бестужевой - Рюминой на Каменном острове.,2.0
28682407,22,2.0,Панорама Невы вниз по течению от старого Зимнего дворца и Академией наук.,2.0
28682387,22,2.0,Дворец Бестужевых-Рюминых на Каменном острове со стороны Малой Невки.,2.0
28682353,22,2.0,Дворец Бестужевых-Рюминых на Каменном острове со стороны Малой Невки.,2.0
28682341,22,2.0,Большой Петергофский дворец со стороны Нижнего парка.,2.0
28868538,22,2.0,Проспект вверх по Неве от Адмиралтейства и Академии наук.,2.0
28868464,22,2.0,Проспект вниз по Неве-реке от Невского моста между Исаакиевской церковью и Кадетским корпусом.,2.0
31090051,22,2.0,(Россия.) Красные Триумфальные ворота в Москве. Табл. 16,2.0
33611063,22,3.0,"Академия наук и художеств, библиотека и Кунсткамера, здание Двенадцати коллегий, Исаакиевский мост, Зимний дворец, Адмиралтейство, Исаакиевский собор («Проспект вниз по Неве реке между Зимним Ея Императорского Величества домом и Академией наук»). Из альбома с планом и видами г. Санкт-Петербурга по рисункам М.И. Махаева.",2.0
33611100,22,3.0,"Театр фейерверков и иллюминаций. Петропавловская крепость, главы церкви Живоначальной Троицы в Петербургской части, третий и четвертый Зимний дворец («Проспект вверх по Неве реке от Адмиралтейства и Академии наук к востоку»). Из альбома с планом и видами г. Санкт-Петербурга по рисункам М.И. Махаева.",2.0
16214859,22,5.0,Большой Царскоселький дворец со стороны парадного двора,2.0
28545097,23,1.0,"г. Санкт-Петербург. Аничков дворец. Невский пр-т, 39. 1741-1754 гг., 1776-1778 гг. - переделка, 1809-1810 гг., 1817-1818 гг., 1875 г. г. Санкт-Петербург. «Проспект новопостроенных палат против Аничковских ворот от восточной стороны с частию Санктпетербурга и Невской перспективной дороги от реки Фонтанки». Панорамный вид Невского проспекта в сторону Адмиралтейства. Архитектор: Земцов М.Г.; Архитектор: Дмитриев Г.Д.; Архитектор: Старов И.Е.; Архитектор: Руска Л.; Архитектор: Росси К.И.; Архитектор: Рахау К.К.",1.0
